ID,Since,Last tweeted at,Tweets,Favorites,Listed,Following,Followers,Screen name,Name,Verified,Protected,Bio,Status,Location,URL
16102671,2008-09-02 20:41:33 +0000,2016-04-25 19:08:07 +0000,36063,25306,1523,666,49521,beckycloonan,becky cloonan,false,false,Dreamweaver. Lonely wolf.,@GobsOsborn @GoshComics thanks for stopping by!,ATX,http://beckycloonan.net
16395449,2008-09-21 21:34:40 +0000,2016-04-25 19:06:02 +0000,59459,2512,5223,262,151949,BRIANMBENDIS,BRIAN MICHAEL BENDIS,true,false,"Executive producer- Powers TV for PSN. Co-creator of Marvel's Jessica Jones, Writer- Ultimate Spider-man, Guardians of the Galaxy, Powers, Etc.",@kellysue come on! @AlisaBendis gets that many emails a day just from Nordstrom :),Portland,http://www.jinxworld.com
15877164,2008-08-16 22:18:09 +0000,2016-04-25 18:34:54 +0000,29502,1449,2836,1105,80347,brubaker,Ed Brubaker,false,false,"Writer of comics and TV and film. Currently KILL OR BE KILLED, VELVET, HBO's WESTWORLD and Nicolas Winding Refn's Maniac Cop","One of my favorite cartoonists ever: ""Celebrating The Infamous Johnny Craig"" https://t.co/vqAFGz2rmx",Windy Silverlake,
16031897,2008-08-28 20:02:31 +0000,2016-04-25 19:11:32 +0000,77929,283,4631,786,167411,CBR,Comic Book Resources,false,false,"CBR is the leading source for comic book entertainment news, commentary and community.","Russo Brothers Nab ""The Mastermind"" https://t.co/9z86851PN7 https://t.co/F3ZIrTnWVi","Los Angeles, CA",http://comicbookresources.com
182238594,2010-08-24 04:18:51 +0000,2016-04-25 17:23:41 +0000,14026,9858,1086,31244,38772,ComicBookGrrl,Blake Northcott,false,false,"Author of the 'Arena Mode Saga' and Slayer of Vampires (only the sparkly ones). Writes for Millarworld, CBR & CBS. Rep'd by @kirstencarleton at Prospect Agency.",Tim Hortons: the only thing that makes a chilly Canadian Monday 5% more bearable. An argument could be made for 7%. https://t.co/3XtrqICJhe,"Toronto, Ontario",https://www.patreon.com/blakenorthcott
126285329,2010-03-25 10:51:35 +0000,2016-04-25 14:30:13 +0000,18424,0,834,268,31341,davaja,David Aja,true,false,My mind is in the gutters,@RyanDoell31 Hah! Awesome!,,http://blog.davidaja.com
258983552,2011-02-28 22:45:23 +0000,2016-04-23 12:24:46 +0000,961,31,66,197,4120,DavidLloydESPN,David Lloyd,true,false,I hope I can be the man my dog thinks I am. Sportscenter Coast to Coast 12pm eastern.,RT @ryan_powell63: Fam&amp;I hand delivered one of the original RPWP3 bats @DukeU 2 be auctioned off!#strikeoutcancer @espn @Orioles @MLB https://t.co/VSzik8wi7G,bouncing off satellites ,
95711070,2009-12-09 19:13:37 +0000,2016-04-25 17:03:05 +0000,12520,121,889,2051,50527,Freecomicbook,Free Comic Book Day,true,false,"The official Free Comic Book Day #FCBD twitter for news, information and more! http://t.co/hXBz3F0F","Art by @goonguy!
#MondayMotivation
#MotivationMonday https://t.co/Q7pvXBOfuR",,http://www.freecomicbookday.com
20305971,2009-02-07 12:06:13 +0000,2016-04-24 20:22:40 +0000,4258,1308,133,1080,2962,getcampbell,laurence campbell,false,false,"Comic Artist working on titles like Punisher Max, Deadpool Pulp, Marvel Universe Vs Wolverine, The Dark Tower, Judge Dredd and BPRD",@cullenbunn really fancy playing that.,UK,http://www.getcampbell.com
18010713,2008-12-10 03:11:38 +0000,2015-12-15 02:33:29 +0000,261,47,1852,1648,81016,grantmorrison,Grant Morrison,false,false,I Can't Believe It's Not Grant Morrison!!!,RT @JonSchnepp: At a time travel birthday party for @olganunes with these Amazos!!! https://t.co/c6hCvKMrIN,DannytheeDrawer ,http://grantmorrison.com/
74173381,2009-09-14 14:50:57 +0000,2016-04-25 17:46:43 +0000,12423,313,1178,259,38578,humberto_ramos,humberto ramos,false,false,soylent green is people,@jokeratedr algo así pero sin azotarse,latveria,https://www.facebook.com/ramos.comic
1552233288,2013-06-28 05:09:56 +0000,2016-04-25 04:06:57 +0000,13904,4,447,45,16981,iamsteranko,Jim Steranko,false,false,STERANKO SUNDAY TNT: Meeting of the Minds! @ 10pm et - Author Illustrator Musician Designer Magician Filmmaker Innovator STERANKO: GRAPHIC PRINCE OF DARKNESS,"A DEEP BOW to you all for spending the evening with me, rapping about the things that drive our lives! Let's do it again next week Henchmen!",for contact info visit,http://www.prevuemag.com
20029472,2009-02-04 05:26:42 +0000,2016-04-20 14:48:04 +0000,17610,2729,4838,1118,211819,JimLee,Jim Lee,true,false,DC Entertainment Co-Publisher. Comics that are good for you.,#NCBD!,"Burbank, CA",http://www.facebook.com/jimlee.fanpage
299450805,2011-05-16 03:22:39 +0000,2016-04-25 18:46:45 +0000,35579,0,444,688,11849,JMDeMatteis,J.M. DeMatteis,false,false,"Eisner award winning writer/editor with more than thirty years experience in comic books, graphic novels, television, film and prose.  http://t.co/Zk4nK7rKzi","@FdoBlanco @THR Thanks, Fernando,  Good to know that working with you wasn't just a dream.  : )",,http://www.facebook.com/jmdematteis
5976992,2007-05-12 00:21:02 +0000,2016-04-25 18:59:13 +0000,56678,35072,1762,1105,57683,kellysue,Kelly Sue DeConnick,true,false,"#imwithher God grant me the serenity 2 accept the things I cannot change, the courage 2 change the things I can & telekinesis so I can murder w/my mind.",Inbox: 114 (0 unread),"Portland, OR",http://kellysue.tumblr.com/
43514656,2009-05-30 11:15:38 +0000,2016-04-25 19:14:31 +0000,12236,16,2570,217,82483,MarkWaid,Mark Waid,true,false,"writer, editor, troubleshooter, troublemaker",@EliotRahal I'll gladly pay you Tuesday for a gas mask today.,Fortress of Solitude,http://www.thrillbent.com
32572986,2009-04-17 20:42:40 +0000,2016-04-25 19:11:14 +0000,30897,9879,201,1309,3520,matthewdowsmith,Matthew Dow Smith,false,false,Writer and Comic Book Artist.,My studio-mate considering creating a masterpiece of her own -- https://t.co/30jiYQ8MlH,"Washington, DC",http://matthewdowsmith.blogspot.com
133404204,2010-04-15 18:01:06 +0000,2016-04-25 15:57:07 +0000,37517,36,2000,2830,73571,mrmarkmillar,Mark Millar,false,false,"Writer of Civil War, Kick-Ass, Kingsman: The Secret Service, Wanted, Starlight, The Ultimates. Creative Consultant at 20th Century Fox. Left-wing Eurosceptic.",Why do all these Civil War actors look like Blind Date contestants from the 90s here??? https://t.co/zoX09hVuxi,Scotland/ United States,http://millarworld.tv
10244292,2007-11-14 12:06:46 +0000,2016-04-25 13:56:20 +0000,46224,73,567,530,7807,mrtonylee,Tony Lee,false,false,#1 New York Times Bestselling Writer. Movie  / TV / Comics / Audio. Repped by Alison Finch of JFL Agency. Runs talks on reluctant reading for schools.,"RT @kevinenhart: Speed sketch and coloring of John Hurt as @bbcdoctorwho . What do you think, @ComicsTitan ? #MakeComics #WarmUp https://t.co/0mwQzwNdfu",London,http://www.tonylee.co.uk
18393773,2008-12-26 19:30:36 +0000,2016-04-25 17:39:06 +0000,95337,1221,35730,900,2406156,neilhimself,Neil Gaiman,true,false,"will eventually grow up and get a real job. Until then, will keep making things up and writing them down.",@LeonFilmreviews  it was a daughter.,a bit all over the place,http://www.neilgaiman.com
97733883,2009-12-18 19:39:20 +0000,2016-04-22 16:44:53 +0000,6138,16,62,1327,1505,ParadiseComics,Paradise Comics,false,false,A comic store in Toronto that has  high grade Golden & Silver Age comics and thousands of graphic novels and issues!  Run by Doug Simpson & Peter Dixon,Always amazing new ideas coming out @Doug_J_Simpson  https://t.co/OaviPE6Gz3,Toronto,http://paradisecomics.com
38682272,2009-05-08 15:10:05 +0000,2016-04-23 13:56:55 +0000,3965,2,5575,438,584186,RobertKirkman,Robert Kirkman,true,false,"Comic book writer and creator of The Walking Dead. I also write Invincible, Outcast & Super Dinosaur for Skybound/Image Comics, yo!",RT @TheWalkingDead: How closely did #TheWalkingDead Season 6 follow the comics?? We broke it down just for you: https://t.co/kAwwae0a7e https://t.co/u5KkVdjIAT,"Backwoods, CA",http://www.skybound.com
46694497,2009-06-12 16:57:50 +0000,2016-04-25 14:41:23 +0000,9465,3026,556,449,28234,RobSchrab,Rob Schrab,true,false,Making a difference by fighting Skeletor and his gross friends.,@CoreyWHart what do you mean?,,http://tinyurl.com/pvovgml
23372773,2009-03-08 23:47:49 +0000,2016-04-25 18:13:56 +0000,46609,83,2413,1163,72455,skottieyoung,skottie young,true,false,Cartoonist and seeker of great comics and art,Seeing Gert/I Hate Fairyland cosplay is so damn cool. the_cave_of_roszombie's photo https://t.co/atGs3a76WO,"Dunlap, IL",http://www.skottieyoung.com
232783642,2011-01-01 08:30:12 +0000,2016-04-25 08:56:33 +0000,5790,9,1034,72,25218,straczynski,JMichael Straczynski,true,false,"Official account for J. Michael Straczynski: co-writer/creator/EP of @sense8.  Owner of Studio JMS, proud coffee co-dependent. Don't post story ideas please.",@Raximous You'd have to ask them.,"Los Angeles, CA",http://www.studiojms.com
65289126,2009-08-13 05:47:33 +0000,2016-04-22 21:51:55 +0000,8335,836,17724,972,2284772,TheRealStanLee,stan lee,true,false,"Stan Lee, Co-Creator of Spider-Man, Iron Man, Hulk, X-Men, etc. Stan's Youtube: https://t.co/9TxNoPvVto",RT @Helmetgirl: I’m excited to start on my @reddit_AMA and talk about my new exhibit &amp; projects: https://t.co/e71daVEmkH 🎊😊💖 https://t.co/sVbPi4dWaC,Los Angeles,http://www.therealstanlee.com
185880665,2010-09-02 01:44:19 +0000,2016-04-25 12:25:14 +0000,3215,810,579,27,21978,WalterSimonson,Walter Simonson,false,false,Just one more guy doing comic books.,"@cyxodus And if you're creating a layout where 9% of your readers are going the wrong way, you'd better consider your options more deeply.",,http://www.facebook.com/waltsimonson?ref=ts
