ID,Since,Last tweeted at,Tweets,Favorites,Listed,Following,Followers,Screen name,Name,Verified,Protected,Bio,Status,Location,URL
793926,2007-02-25 17:48:34 +0000,2016-01-11 15:52:48 +0000,173217,8492,5171,8,85982,1Password,1Password,true,false,"A password manager and secure wallet for Mac, Windows, iOS, and Android.",@mgill25 Me too. ❤️🔐,"Ontario, Canada",https://agilebits.com/onepassword
1278508478,2013-03-18 19:02:41 +0000,2016-01-10 18:50:23 +0000,298,389,103,628,4126,bourbonsass,Bourbon,false,false,A simple and lightweight mixin library for Sass. By @thoughtbot.,@johite Here’s slightly updated and clarified CodePen: https://t.co/bshIEPJfAD,,http://bourbon.io
69426451,2009-08-27 22:37:09 +0000,2016-01-11 06:53:05 +0000,21392,69432,1333,544,26621,CaseyNewton,Casey Newton,true,false,"Silicon Valley editor @verge. Freakishly tall, anime hair. My Starbucks name is Tasty. (DMs open but pitches are ignored. Email me instead.)","RIP David Bowie. A brilliant career, with no finer moment than the time he made fun of Ricky Gervais on Extras https://t.co/yBafYnrwAX",San Francisco,http://cnewton.org/
12652542,2008-01-24 19:11:46 +0000,2016-01-11 12:09:13 +0000,21258,1641,3257,0,36646,culturedcode,Cultured Code,false,false,We make Things.,"@ChrisKerner89 Gibt's noch, und wir arbeiten nach wie vor mit Hochdruck daran :)","Stuttgart, Germany",http://culturedcode.com
2353,2006-07-18 18:14:53 +0000,2016-01-11 00:19:03 +0000,31104,2524,901,3119,13803,davidcrow,David Crow,false,false,Simple caveman. Comfy with uncertainty. Product and community. Sounding board: @streetcontxt @upverter @analyzeRE @send_with_us Photo https://t.co/i881gEAL67,RT @cwhogg: this is a great market map from @BessemerVP from this TC post:  https://t.co/bOJpU9QJhw https://t.co/pG8AOVQFIX,"Toronto, Canada",http://davidcrow.ca/
14749606,2008-05-12 20:54:34 +0000,2016-01-09 01:05:41 +0000,2136,2917,28432,26,4281327,Dropbox,Dropbox,true,false,"Official Dropbox account. Your stuff, anywhere. For customer support, head over to @DropboxSupport.",@eileenberedo  😊,"San Francisco, CA",https://www.dropbox.com
44196397,2009-06-02 20:12:29 +0000,2016-01-11 09:00:43 +0000,1517,224,24302,50,3204938,elonmusk,Elon Musk,true,false,"Tesla, SpaceX, SolarCity & PayPal",Sad to hear that David Bowie died. He was amazing.,1 AU,
299364430,2011-05-15 23:37:59 +0000,2016-01-11 07:52:36 +0000,14408,185678,2145,81116,260769,Everette,Everette Taylor,true,false,building x growing companies,"Prayers up for the family and loved ones of David Bowie, rest in peace","Los Angeles (via Richmond, VA)",http://everettetaylor.com
13837292,2008-02-22 20:49:24 +0000,2016-01-11 12:53:42 +0000,5532,3637,16253,17231,417380,evernote,evernote,true,false,"You have something to accomplish. We publish stories, tips, and tricks that transform how you work. Need help along the way? https://t.co/xWcLR37rOB",RT @HubSpot: Too many ideas swimming around your head? These tools can help keep you organized.  https://t.co/vAEq6HC3h9 https://t.co/fMSymKvRUR,Silicon Valley,http://www.evernote.com
2350159980,2014-02-18 14:01:52 +0000,2016-01-09 19:04:36 +0000,1132,178,64,661,791,fullstackTO,Full Stack Toronto,false,false,Full Stack Toronto is a non-profit organisation that puts on events for web professionals. #webdev #ux #devops #backend #frontend #business and more!,RT @dan_jenkins: @fullstackTO @useTito I'll be getting my talk in soon,"Toronto, Ontario, Canada",http://fsto.co
38679388,2009-05-08 14:53:10 +0000,2016-01-08 18:56:38 +0000,850,39,17973,56,5122014,gmail,Gmail,true,false,"News, tips and tricks from the Gmail team. Need help? Fly on over to our Help Center or forum.",Organize your mail in 1 place this year. Add accounts in Gmail on your new phone #getsetup https://t.co/I8kL0Jq2BX https://t.co/HOwgBXg2ye,"Mountain View, CA",http://www.gmail.com
41901265,2009-05-22 21:07:12 +0000,2015-12-26 09:32:59 +0000,530,253,220,353,5520,gnupg,GNU Privacy Guard,false,false,"GnuPG (aka GPG or often wrongly PGP) encrypts your data and communications. It is free, secure, and  the standard to keep mail content private.",GnuPG status update for November and December: https://t.co/JkjZbWMYdi #32C3 #Tor #tofu #gpgol,Europe,http://www.gnupg.org
20536157,2009-02-10 19:14:39 +0000,2016-01-09 01:35:06 +0000,8279,423,92418,442,13573287,google,Google,true,false,News and updates from Google,"@mikeysjqueen If you don't notice anything, you should be ok. Add extra layers of security to your Google acct here: https://t.co/4iM0oCSLgp","Mountain View, CA",http://www.google.com
32468665,2009-04-17 16:30:28 +0000,2016-01-04 18:31:10 +0000,646,2,8917,40,1497059,googledrive,Google Drive,true,false,Google Drive is a safe place for all your files. Use Drive for free on all your devices. Visit http://t.co/ReoUx29Gxc to get started.,Don't lose anything in 2016. Back up files and photos in Drive on your new device #getsetup https://t.co/UxwG1fwvb6 https://t.co/pspJJx2Hhj,"Mountain View, CA",http://www.google.com/drive
2892261,2007-03-29 20:50:40 +0000,2016-01-10 07:39:04 +0000,902,84,1412,16,34679,Hak5,Hak5,false,false,"Hak5 isn’t your typical tech show. Damn the warranties, it’s time to Trust your Technolust. Follow the hosts here: @hak5darren & @snubs",@mmmbud Yes and we will be again on Wednesday.,The Internets,http://www.hak5.org
1688461,2007-03-20 23:44:33 +0000,2016-01-10 02:13:43 +0000,10637,172,1793,287,34929,hak5darren,Darren Kitchen,false,false,"Host, producer and founder of the online web series Hak5.",@acedtect @ClintA you're right I misspoke https encrypts everything past the domain,"San Francisco, CA",http://darrenkitchen.com
15086405,2008-06-11 16:42:10 +0000,2016-01-11 15:39:21 +0000,36094,123,6686,45,143909,iMore,iMore,false,false,"Expanding your Apple universe with expert analysis, how-tos, and reviews for Mac, iPhone, iPad, Watch, TV, and beyond.

Standard feed: @imore_headlines","On @iMore show 492 @settern @Georgia_Dow @reneritchie talks headsets jacks, cyber security, and iMore 2016! iMore https://t.co/td2C5rE7Nv","Cupertino, CA",http://www.imore.com
235193328,2011-01-07 15:53:54 +0000,2016-01-08 03:47:43 +0000,151,1155,62,129,781,indiewebcamp,IndieWebCamp,false,false,"Rather than posting content on 3rd-party silos, we should all begin owning our data when we create it.","RT @kevinmarks: “As Maimonides, were he alive today, would tell us: he who excludes a single user destroys a universe.” https://t.co/kMiWh7ufuW #indieweb","Portland, Oregon",http://indiewebcamp.com
7144422,2007-06-29 03:44:14 +0000,2016-01-11 15:56:06 +0000,39838,8,36026,58,2965137,lifehacker,Lifehacker,true,false,Don't live to geek; geek to live.,AT&amp;T is bringing back unlimited data! But you have to bundle it with home internet service. https://t.co/ONGvzjT2j7 https://t.co/IqcZVBSdxJ,,http://lifehacker.com
2558446890,2014-06-10 07:44:06 +0000,2016-01-11 13:16:51 +0000,6340,4733,436,116,16753,MacAffinity,Affinity,false,false,"Affinity is the next-generation imaging and design suite for creative professionals, built exclusively for Mac.","@kaunteya28 No, sorry.",,https://affinity.serif.com/
972651,2007-03-12 01:28:01 +0000,2016-01-11 15:59:09 +0000,171933,588,127627,2834,6457045,mashable,Mashable,true,false,"News, resources, inspiration and fun for the connected generation. Tweets by @mashable staff.",These round pictures were some of the first candid snapshots. https://t.co/qRKH9OOR4w ht @theretronaut https://t.co/40jhxx5m4A,,http://mashable.com
3496641,2007-04-05 06:32:55 +0000,2016-01-11 13:48:03 +0000,24799,6829,3999,1582,88780,reckless,nilay patel,true,false,Editor-in-chief of The Verge. I am in love with spectacle.,Audi's X-Prize moon rover looks so cool. https://t.co/BQilw0rpOd,"Brooklyn, NY",http://theverge.com
79033767,2009-10-01 23:25:50 +0000,2015-11-25 15:20:41 +0000,1544,3,3831,102,48719,reederapp,Reeder,false,false,Mostly announcements and updates here. Please use email for support and other questions.,"Reeder 3 for iOS is out.
https://t.co/K6kPKLH2pP
https://t.co/P1OHg7ojqP","Chur, Switzerland",http://reederapp.com
1269955578,2013-03-15 15:22:54 +0000,2015-12-23 07:02:01 +0000,916,156,949,26,34965,SassCSS,Sass,false,false,"The official Sass twitter account. Follow everyone's favorite CSS language for updates, information, and announcements.",@santi6291 we believe everything you'd need to do with dynamic variables can be done more cleanly with maps,,http://sass-lang.com
2459371,2007-03-27 10:48:31 +0000,2016-01-11 15:58:32 +0000,107495,1681,11071,1450,5050048,Skype,Skype,true,false,The latest news and updates from the team at Skype. Follow the link below to discover all the wonderful things Skype has to offer.,@gnuyoga That's strange! Reach out to @SkypeSupport for help with your account.,Everywhere,http://www.skype.com
14078275,2008-03-04 15:32:41 +0000,2016-01-11 14:40:52 +0000,2324,49,550,10,6819,SmileSoftware,Smile,false,false,"Mac & iOS productivity software, developers of PDFpen, DiscLabel, TextExpander. For fastest support: support@smilesoftware.com.","This week's @coreint is #SmileSponsored, Ep 214: ""You Of All People Should Understand."" https://t.co/ivsjmAI77z Brought to you by @PDFpen!",Bay Area and Portland,http://www.smilesoftware.com
2916305152,2014-12-11 21:24:28 +0000,2015-12-30 18:31:04 +0000,373,0,10829,1,1745662,Snowden,Edward Snowden,true,false,I used to work for the government. Now I work for the public. Director at @FreedomofPress.,Bonus points to the first journalist to get an official ruling from @fka_roscosmos and/or @neiltyson. (Corrected) https://t.co/YhYxUczKTn,,https://freedom.press
14203895,2008-03-23 22:09:11 +0000,2016-01-11 06:15:16 +0000,17911,451,1651,251,32795,Snubs,Shannon Morse,false,false,"Internet Media Podcaster and Producer for shows with @Hak5 & @TekThing -  Singer, Actor, Gamer, Geek & Gadget Enthusiast. Views R Mine!","@atarinerd @Satyr607 @getstolen sorry, I'm not up for grabs, but enjoy your app. #married #iownagun","San Francisco, CA, USA",http://www.snubsie.com
766250432,2012-08-18 19:25:13 +0000,2016-01-10 06:07:11 +0000,166,2,324,56,8582,Tails_live,Tails live system,false,false,"Tails is a live operating system that aims at preserving your privacy and anonymity.

Support requests on Twitter will not be answered.",Tails 1.8.2 is out: https://t.co/fKfcF8XvIj,,https://tails.boum.org/
16669898,2008-10-09 17:47:49 +0000,2016-01-11 13:47:07 +0000,10801,0,6821,4,276343,tapbots,Tapbots,false,false,We make useful robots for your iPhone.,@barthoefs We're looking into it.,"Silicon Valley, CA",http://tapbots.com
1143896910,2013-02-03 01:42:58 +0000,2016-01-10 23:21:13 +0000,9608,8688,595,837,32559,thegrid,The Grid,false,false,"Website creation powered by artificial intelligence. @d4tocchini, Founder & CEO.",RT @tomwontstop: just got my @thegrid invite! This could not have come at a better time! Looking forward to testing it out!!,San Francisco,http://thegrid.io
63362222,2009-08-06 03:53:27 +0000,2016-01-11 15:02:41 +0000,1620,10,649,37,7644,thesweetsetup,The Sweet Setup,false,false,"We enjoy spending an inordinate amount of time and energy to research, test, and find the very best apps for iOS and Mac.

(By @shawnblanc and friends.)","The Pebble Time Steel ($200) is just shy of the lowest price we've seen on the device.

https://t.co/uyIsdkTXbc https://t.co/w21EUg1der",,http://thesweetsetup.com
14114392,2008-03-10 15:04:12 +0000,2016-01-11 13:45:12 +0000,4258,709,1669,613,44691,thoughtbot,thoughtbot,true,false,web + mobile + design + development,Announcing Scenic - Versioned Database Views for Rails https://t.co/8w98kxdiGC,United States + Sweden + UK,http://thoughtbot.com
118059149,2010-02-27 13:27:37 +0000,2016-01-08 15:28:07 +0000,12102,266,1126,963,31999,virusbtn,Virus Bulletin,false,false,"Security information portal, testing and certification body.","""Just another computer joining the internet. But the stakes are so much higher."" On @MarieGMoe and smart hearts https://t.co/OcjUckvuhq","Oxfordshire, UK",http://www.virusbtn.com/
